{
  "schemaVersion": 1,
  "retrievedOn": "2026-08-27",
  "profiles": {
    "ge-front-washer": {
      "brand": "GE",
      "kind": "washer",
      "label": "front-load washer",
      "productCodePrompt": "Enter the complete engineering model from the rating label; do not infer a revision from the public family code.",
      "topology": "hose-only",
      "profile": "washer-hose-only",
      "supportedSymptom": "will-not-drain",
      "loadStyle": "front-load",
      "checkProfile": "hose-then-service",
      "troubleshootingSources": [
        {
          "id": "exp-ge-front-washer-drain",
          "title": "GE front-load washer will-not-drain guidance",
          "url": "https://products.geappliances.com/appliance/gea-support-search-content?contentId=23081",
          "publisher": "GE Appliances",
          "appliesTo": "GE front-load washers"
        }
      ]
    },
    "ge-top-washer": {
      "brand": "GE",
      "kind": "washer",
      "label": "top-load washer",
      "productCodePrompt": "Enter the complete engineering model from the rating label; do not infer a revision from the public family code.",
      "topology": "washer-top-load",
      "profile": "washer-hose-only",
      "supportedSymptom": "will-not-drain",
      "loadStyle": "top-load",
      "checkProfile": "hose-then-service",
      "troubleshootingSources": [
        {
          "id": "exp-ge-top-washer-drain",
          "title": "GE top-load washer will-not-drain guidance",
          "url": "https://products.geappliances.com/appliance/gea-support-search-content?contentId=23080",
          "publisher": "GE Appliances",
          "appliesTo": "GE top-load washers"
        }
      ]
    },
    "hotpoint-top-washer": {
      "brand": "Hotpoint",
      "kind": "washer",
      "label": "top-load washer",
      "productCodePrompt": "Enter the complete engineering model from the rating label; do not infer a revision from the public family code.",
      "topology": "washer-top-load",
      "profile": "washer-hose-only",
      "supportedSymptom": "will-not-drain",
      "loadStyle": "top-load",
      "checkProfile": "hose-then-service",
      "troubleshootingSources": [
        {
          "id": "exp-hotpoint-top-washer-drain",
          "title": "GE Appliances top-load washer will-not-drain guidance",
          "url": "https://products.geappliances.com/appliance/gea-support-search-content?contentId=23080",
          "publisher": "GE Appliances",
          "appliesTo": "Hotpoint top-load washers"
        }
      ]
    },
    "whirlpool-front-washer": {
      "brand": "Whirlpool",
      "kind": "washer",
      "label": "front-load washer",
      "productCodePrompt": "Enter the complete model and final engineering suffix or digit from the rating label.",
      "topology": "hose-only",
      "profile": "washer-hose-only",
      "supportedSymptom": "will-not-drain",
      "loadStyle": "front-load",
      "checkProfile": "hose-then-service",
      "troubleshootingSources": [
        {
          "id": "exp-whirlpool-front-washer-drain",
          "title": "Whirlpool front-load washer not-draining guidance",
          "url": "https://producthelp.whirlpool.com/Laundry/Washers/Front_Load_Washers/Cycle_Concerns/Not_Draining/Not_Draining_-_Front_Load_Washer",
          "publisher": "Whirlpool",
          "appliesTo": "Whirlpool front-load washers"
        }
      ]
    },
    "whirlpool-top-washer": {
      "brand": "Whirlpool",
      "kind": "washer",
      "label": "top-load washer",
      "productCodePrompt": "Enter the complete model and final engineering suffix or digit from the rating label.",
      "topology": "washer-top-load",
      "profile": "washer-hose-only",
      "supportedSymptom": "will-not-drain",
      "loadStyle": "top-load",
      "checkProfile": "hose-then-service",
      "troubleshootingSources": [
        {
          "id": "exp-whirlpool-top-washer-drain",
          "title": "Whirlpool top-load washer not-draining guidance",
          "url": "https://producthelp.whirlpool.com/Laundry/Washers/Top_Load_Washer/Cycle_Concerns/Not_Draining_-_Washer",
          "publisher": "Whirlpool",
          "appliesTo": "Whirlpool top-load washers"
        }
      ]
    },
    "maytag-front-washer": {
      "brand": "Maytag",
      "kind": "washer",
      "label": "front-load washer",
      "productCodePrompt": "Enter the complete model and final engineering suffix or digit from the rating label.",
      "topology": "hose-only",
      "profile": "washer-hose-only",
      "supportedSymptom": "will-not-drain",
      "loadStyle": "front-load",
      "checkProfile": "hose-then-service",
      "troubleshootingSources": [
        {
          "id": "exp-maytag-front-washer-drain",
          "title": "Maytag front-load washer not-draining guidance",
          "url": "https://producthelp.maytag.com/Laundry/Washers/Front_Load_Washers/Cycle_Concerns/Not_Draining/Not_Draining_-_Front_Load_Washer",
          "publisher": "Maytag",
          "appliesTo": "Maytag front-load washers"
        }
      ]
    },
    "maytag-top-washer": {
      "brand": "Maytag",
      "kind": "washer",
      "label": "top-load washer",
      "productCodePrompt": "Enter the complete model and final engineering suffix or digit from the rating label.",
      "topology": "washer-top-load",
      "profile": "washer-hose-only",
      "supportedSymptom": "will-not-drain",
      "loadStyle": "top-load",
      "checkProfile": "hose-then-service",
      "troubleshootingSources": [
        {
          "id": "exp-maytag-top-washer-drain",
          "title": "Maytag washer not-draining or spinning guidance",
          "url": "https://producthelp.maytag.com/Laundry/Washers/Product_Info/Washer_Product_Assistance/Washer_Not_Draining_or_Spinning%3F_Troubleshooting_Guide",
          "publisher": "Maytag",
          "appliesTo": "Maytag top-load washers"
        }
      ]
    },
    "amana-front-washer": {
      "brand": "Amana",
      "kind": "washer",
      "label": "front-load washer",
      "productCodePrompt": "Enter the complete model and final engineering suffix or digit from the rating label.",
      "topology": "hose-only",
      "profile": "washer-hose-only",
      "supportedSymptom": "will-not-drain",
      "loadStyle": "front-load",
      "checkProfile": "hose-then-service",
      "troubleshootingSources": [
        {
          "id": "exp-amana-front-washer-drain",
          "title": "Amana front-load washer not-draining guidance",
          "url": "https://producthelp.amana.com/Laundry/Washers/Front_Load_Washers/Cycle_Concerns/Not_Draining/Not_Draining_-_Front_Load_Washer",
          "publisher": "Amana",
          "appliesTo": "Amana front-load washers"
        }
      ]
    },
    "amana-top-washer": {
      "brand": "Amana",
      "kind": "washer",
      "label": "top-load washer",
      "productCodePrompt": "Enter the complete model and final engineering suffix or digit from the rating label.",
      "topology": "washer-top-load",
      "profile": "washer-hose-only",
      "supportedSymptom": "will-not-drain",
      "loadStyle": "top-load",
      "checkProfile": "hose-then-service",
      "troubleshootingSources": [
        {
          "id": "exp-amana-top-washer-drain",
          "title": "Amana top-load washer not-draining guidance",
          "url": "https://producthelp.amana.com/Laundry/Washers/Top_Load_Washer/Cycle_Concerns/Not_Draining_-_Washer",
          "publisher": "Amana",
          "appliesTo": "Amana top-load washers"
        }
      ]
    },
    "samsung-front-washer": {
      "brand": "Samsung",
      "kind": "washer",
      "label": "front-load washer",
      "productCodePrompt": "Enter the complete Samsung model code exactly as printed, including any slash or country suffix.",
      "topology": "front-filter",
      "profile": "washer-front-drain",
      "supportedSymptom": "will-not-drain",
      "loadStyle": "front-load",
      "checkProfile": "filter-access",
      "troubleshootingSources": [
        {
          "id": "exp-samsung-washer-drain",
          "title": "Samsung washing machine will-not-drain guidance",
          "url": "https://www.samsung.com/us/support/troubleshoot/TSG10007110/",
          "publisher": "Samsung",
          "appliesTo": "Samsung washers"
        },
        {
          "id": "exp-samsung-washer-filter",
          "title": "Samsung washer pump-filter cleaning",
          "url": "https://www.samsung.com/us/support/answer/ANS10003197/",
          "publisher": "Samsung",
          "appliesTo": "Samsung front-load washers with the documented access door"
        }
      ]
    },
    "samsung-top-washer": {
      "brand": "Samsung",
      "kind": "washer",
      "label": "top-load washer",
      "productCodePrompt": "Enter the complete Samsung model code exactly as printed, including any slash or country suffix.",
      "topology": "washer-top-load",
      "profile": "washer-hose-only",
      "supportedSymptom": "will-not-drain",
      "loadStyle": "top-load",
      "checkProfile": "hose-then-service",
      "troubleshootingSources": [
        {
          "id": "exp-samsung-top-washer-drain",
          "title": "Samsung washing machine will-not-drain guidance",
          "url": "https://www.samsung.com/us/support/troubleshoot/TSG10007110/",
          "publisher": "Samsung",
          "appliesTo": "Samsung top-load washers"
        }
      ]
    },
    "lg-front-washer": {
      "brand": "LG",
      "kind": "washer",
      "label": "front-load washer",
      "productCodePrompt": "Enter the complete dotted LG product suffix exactly as printed; neighboring suffixes are separate revisions.",
      "topology": "front-filter",
      "profile": "washer-front-drain",
      "supportedSymptom": "will-not-drain",
      "loadStyle": "front-load",
      "checkProfile": "filter-access",
      "troubleshootingSources": [
        {
          "id": "exp-lg-front-washer-drain",
          "title": "LG washer water-not-draining guidance",